{
  "chunk_id": "c_001",
  "document_id": "doc_001",
  "version_id": "v1",
  "block_refs": ["b_001"],
  "text": "El GAFI establece recomendaciones para prevenir el lavado de dinero.",
  "metadata": {
    "document_type": "policy",
    "language": "es",
    "version_status": "active"
  },
  "acl": {
    "users": [],
    "groups": ["compliance"]
  },
  "index_status": "pending"
}

